ID,カードパック,カード名,属性,カード種別,レアリティ,コスト,攻撃力,HP,効果,効果関数
160,COR,野望の継承者 ウェスカー,Black,Unit Card,Legendary,6,17,17,場に出た時：攻撃力とHPを味方ヒーローのライフ分マイナスする＜解放＞：10MP5以下のランダムな敵ユニット1体を破壊,unleash:10
161,COR,伝説喰らいの古龍 ネルギガンテ,Black,Unit Card,Legendary,6,0,1,＜ヴェール＞プレイ時：自分のデッキからカードを5枚まで墓地に送り、+4/+10敵ユニットが死亡：自分の墓地からMP4以下のランダムなユニット1体をEXポケットに戻す,veil;play:send_to_graveyard:5;play:buff_self_attack:4;play:buff_self_hp:10
162,COR,強化蘇生,Black,Action Card,Common,5,,,自分の墓地からランダムなユニット1体を+1/+1して場に出す,revive_from_graveyard
163,COR,屍肉漁り,Black,Action Card,Common,3,,,自分の墓地からランダムなMP5以上のユニット1体を+1/+1して、EXポケットに戻す,revive_from_graveyard
164,COR,下僕の使役,Black,Action Card,Common,4,,,2ライフ犠牲デッキ内のMP4以下のユニット1体を場に出すそのユニットに「死亡時：自身を除外」を付与,life_sacrifice:2
165,COR,心無き実験,Black,Action Card,Common,1,,,3ライフ犠牲味方ユニット1体の攻撃力+2（1回攻撃するまで）,life_sacrifice:3;buff_target_attack_temp:2
166,COR,サイコパワー,Black,Action Card,Common,2,,,7ライフ犠牲味方ユニット1体に+2/+2,life_sacrifice:7;buff_target_attack:2;buff_target_hp:2
167,COR,破壊の本能,Black,Action Card,Common,5,,,敵ユニット1体を破壊し、味方ヒーローに破壊したユニットの攻撃力分のダメージ,destroy_target;death_damage_hero_by_attack
168,COR,悲しき変異,Black,Action Card,Common,2,,,味方ユニット1体の攻撃力+41回攻撃すると破壊を付与,buff_target_attack:4
169,COR,残虐な遊び,Black,Action Card,Common,2,,,攻撃力1以下の敵ユニット1体を破壊味方ヒーローのライフが15以下の場合、代わりにMP4以下の敵ユニット1体を破壊、MP+1,destroy_target
170,COR,集結する魂,Black,Action Card,Rare,2,,,デッキ内の＜リベンジ＞が発動しているユニット1体をEXポケットに加える,draw_to_ex
171,COR,自業自得,Black,Action Card,Rare,4,,,味方ユニット1体を破壊し、ランダムな敵ユニット1体を破壊,destroy_friendly;destroy_random_enemy
172,COR,悪魔との契約,Black,Action Card,Rare,1,,,自分のデッキを3枚除外味方ユニット1体に「＜リベンジ＞：+2/+2」付与,send_to_graveyard:3
173,COR,身勝手な捕食,Black,Action Card,Rare,1,,,味方ユニット1体を破壊し、味方ヒーローのライフ+4,destroy_friendly;heal_hero:4
174,COR,狂気の殺戮,Black,Action Card,Rare,1,,,味方ユニット1体を破壊し、敵ユニットに5ダメージを振り分ける,destroy_friendly;split_damage_all_enemy_units:5
175,COR,偽りの王座,Black,Action Card,Rare,2,,,デッキ内の最もMPの高いユニット1体を墓地に送る,send_to_graveyard:1
176,COR,抹殺,Black,Action Card,Epic,6,,,ユニット1体を破壊,destroy_target
177,COR,乗り移る悪意,Black,Action Card,Epic,3,,,ユニット1体を除外し、同じ枠に再度出すユニットのMP分味方ヒーローにダメージ同じ枠が空いていない場合は登場しない,
178,COR,無音の処刑,Black,Action Card,Epic,3,,,攻撃力2以下の敵ユニット1体を破壊味方ヒーローのライフが15以下の場合、代わりに攻撃力4以下の敵ユニット1体を破壊,destroy_target
179,COR,広がりゆく感染,Black,Action Card,Legendary,5,,,全ての自分の枠に黒感染者を出す,summon_token:3
180,COR,血の宿命,Black,Action Card,Legendary,2,,,味方ユニット1体に自分の墓地にある黒ユニットの数分、攻撃力+1そのユニットに「死亡時：味方ヒーローに攻撃力分のダメージ」付与［カード枚数：0］,damage_by_graveyard_count;death:death_damage_hero_by_attack
